{
  "pack_key": "goal_library",
  "version": 1,
  "pack_schema_version": 1,
  "locale": "fa",
  "min_app_version": "1.0.0",
  "entries": [
    {
      "key": "sleep_window_open",
      "title_key": "goal.sleep_window_open.title",
      "icon": "wb_sunny",
      "area_key": "sleep",
      "tabs": [
        "health",
        "sleep",
        "easy_wins"
      ],
      "difficulty": 1,
      "minutes": 2,
      "default_time_of_day": "morning",
      "default_repeat": "daily",
      "need_tags": [
        "low_sleep",
        "mid_sleep"
      ]
    },
    {
      "key": "sleep_phone_away",
      "title_key": "goal.sleep_phone_away.title",
      "icon": "phone_off",
      "area_key": "sleep",
      "tabs": [
        "sleep",
        "health"
      ],
      "difficulty": 2,
      "minutes": 30,
      "default_time_of_day": "evening",
      "default_repeat": "daily",
      "need_tags": [
        "mid_sleep"
      ]
    },
    {
      "key": "sleep_fixed_wake",
      "title_key": "goal.sleep_fixed_wake.title",
      "icon": "alarm",
      "area_key": "sleep",
      "tabs": [
        "sleep",
        "health"
      ],
      "difficulty": 2,
      "minutes": 5,
      "default_time_of_day": "morning",
      "default_repeat": "daily",
      "need_tags": [
        "mid_sleep"
      ]
    },
    {
      "key": "sleep_warm_drink",
      "title_key": "goal.sleep_warm_drink.title",
      "icon": "local_cafe",
      "area_key": "sleep",
      "tabs": [
        "sleep",
        "calm"
      ],
      "difficulty": 1,
      "minutes": 10,
      "default_time_of_day": "evening",
      "default_repeat": "daily",
      "need_tags": [
        "low_sleep",
        "mid_sleep"
      ]
    },
    {
      "key": "sleep_dim_lights",
      "title_key": "goal.sleep_dim_lights.title",
      "icon": "light_mode",
      "area_key": "sleep",
      "tabs": [
        "sleep",
        "calm"
      ],
      "difficulty": 1,
      "minutes": 5,
      "default_time_of_day": "evening",
      "default_repeat": "daily",
      "need_tags": [
        "low_sleep",
        "mid_sleep"
      ]
    },
    {
      "key": "sleep_no_late_tea",
      "title_key": "goal.sleep_no_late_tea.title",
      "icon": "free_breakfast",
      "area_key": "sleep",
      "tabs": [
        "sleep",
        "health"
      ],
      "difficulty": 2,
      "minutes": 1,
      "default_time_of_day": "afternoon",
      "default_repeat": "daily",
      "need_tags": [
        "mid_sleep"
      ]
    },
    {
      "key": "sleep_stretch_bed",
      "title_key": "goal.sleep_stretch_bed.title",
      "icon": "self_improvement",
      "area_key": "sleep",
      "tabs": [
        "sleep",
        "movement"
      ],
      "difficulty": 1,
      "minutes": 5,
      "default_time_of_day": "evening",
      "default_repeat": "daily",
      "need_tags": [
        "low_sleep",
        "mid_sleep"
      ]
    },
    {
      "key": "sleep_tomorrow_list",
      "title_key": "goal.sleep_tomorrow_list.title",
      "icon": "edit_note",
      "area_key": "sleep",
      "tabs": [
        "sleep",
        "tidy"
      ],
      "difficulty": 1,
      "minutes": 5,
      "default_time_of_day": "evening",
      "default_repeat": "daily",
      "need_tags": [
        "low_sleep",
        "mid_sleep"
      ]
    },
    {
      "key": "sleep_nap_short",
      "title_key": "goal.sleep_nap_short.title",
      "icon": "bedtime",
      "area_key": "sleep",
      "tabs": [
        "sleep",
        "easy_wins"
      ],
      "difficulty": 1,
      "minutes": 10,
      "default_time_of_day": "afternoon",
      "default_repeat": "daily",
      "need_tags": [
        "low_sleep",
        "mid_sleep"
      ]
    },
    {
      "key": "sleep_bed_ready",
      "title_key": "goal.sleep_bed_ready.title",
      "icon": "bed",
      "area_key": "sleep",
      "tabs": [
        "sleep",
        "tidy"
      ],
      "difficulty": 1,
      "minutes": 3,
      "default_time_of_day": "evening",
      "default_repeat": "daily",
      "need_tags": [
        "low_sleep",
        "mid_sleep"
      ]
    },
    {
      "key": "sleep_screen_free_morning",
      "title_key": "goal.sleep_screen_free_morning.title",
      "icon": "smartphone",
      "area_key": "sleep",
      "tabs": [
        "sleep",
        "calm"
      ],
      "difficulty": 3,
      "minutes": 30,
      "default_time_of_day": "morning",
      "default_repeat": "daily",
      "need_tags": []
    },
    {
      "key": "sleep_early_dinner",
      "title_key": "goal.sleep_early_dinner.title",
      "icon": "dinner_dining",
      "area_key": "sleep",
      "tabs": [
        "sleep",
        "health"
      ],
      "difficulty": 2,
      "minutes": 30,
      "default_time_of_day": "evening",
      "default_repeat": "daily",
      "need_tags": [
        "mid_sleep"
      ]
    },
    {
      "key": "calm_five_breaths",
      "title_key": "goal.calm_five_breaths.title",
      "icon": "air",
      "area_key": "calm",
      "tabs": [
        "calm",
        "easy_wins"
      ],
      "difficulty": 1,
      "minutes": 2,
      "default_time_of_day": "any",
      "default_repeat": "daily",
      "need_tags": [
        "low_calm",
        "mid_calm"
      ]
    },
    {
      "key": "calm_tea_slow",
      "title_key": "goal.calm_tea_slow.title",
      "icon": "emoji_food_beverage",
      "area_key": "calm",
      "tabs": [
        "calm",
        "easy_wins"
      ],
      "difficulty": 1,
      "minutes": 10,
      "default_time_of_day": "afternoon",
      "default_repeat": "daily",
      "need_tags": [
        "low_calm",
        "mid_calm"
      ]
    },
    {
      "key": "calm_quiet_minute",
      "title_key": "goal.calm_quiet_minute.title",
      "icon": "hearing",
      "area_key": "calm",
      "tabs": [
        "calm",
        "easy_wins"
      ],
      "difficulty": 1,
      "minutes": 2,
      "default_time_of_day": "any",
      "default_repeat": "daily",
      "need_tags": [
        "low_calm",
        "mid_calm"
      ]
    },
    {
      "key": "calm_music_one",
      "title_key": "goal.calm_music_one.title",
      "icon": "music_note",
      "area_key": "calm",
      "tabs": [
        "calm"
      ],
      "difficulty": 1,
      "minutes": 5,
      "default_time_of_day": "evening",
      "default_repeat": "daily",
      "need_tags": [
        "low_calm",
        "mid_calm"
      ]
    },
    {
      "key": "calm_slow_shower",
      "title_key": "goal.calm_slow_shower.title",
      "icon": "shower",
      "area_key": "calm",
      "tabs": [
        "calm",
        "health"
      ],
      "difficulty": 2,
      "minutes": 10,
      "default_time_of_day": "evening",
      "default_repeat": "daily",
      "need_tags": [
        "mid_calm"
      ]
    },
    {
      "key": "calm_shoulder_drop",
      "title_key": "goal.calm_shoulder_drop.title",
      "icon": "accessibility_new",
      "area_key": "calm",
      "tabs": [
        "calm",
        "movement",
        "easy_wins"
      ],
      "difficulty": 1,
      "minutes": 1,
      "default_time_of_day": "any",
      "default_repeat": "daily",
      "need_tags": [
        "low_calm",
        "mid_calm"
      ]
    },
    {
      "key": "calm_worry_paper",
      "title_key": "goal.calm_worry_paper.title",
      "icon": "draw",
      "area_key": "calm",
      "tabs": [
        "calm",
        "gratitude"
      ],
      "difficulty": 2,
      "minutes": 10,
      "default_time_of_day": "evening",
      "default_repeat": "daily",
      "need_tags": [
        "mid_calm"
      ]
    },
    {
      "key": "calm_green_look",
      "title_key": "goal.calm_green_look.title",
      "icon": "park",
      "area_key": "calm",
      "tabs": [
        "calm",
        "easy_wins"
      ],
      "difficulty": 1,
      "minutes": 2,
      "default_time_of_day": "any",
      "default_repeat": "daily",
      "need_tags": [
        "low_calm",
        "mid_calm"
      ]
    },
    {
      "key": "calm_single_task",
      "title_key": "goal.calm_single_task.title",
      "icon": "center_focus_strong",
      "area_key": "calm",
      "tabs": [
        "calm"
      ],
      "difficulty": 2,
      "minutes": 15,
      "default_time_of_day": "any",
      "default_repeat": "daily",
      "need_tags": [
        "mid_calm"
      ]
    },
    {
      "key": "calm_unplug_meal",
      "title_key": "goal.calm_unplug_meal.title",
      "icon": "restaurant",
      "area_key": "calm",
      "tabs": [
        "calm",
        "health"
      ],
      "difficulty": 2,
      "minutes": 15,
      "default_time_of_day": "any",
      "default_repeat": "daily",
      "need_tags": [
        "mid_calm"
      ]
    },
    {
      "key": "calm_face_wash",
      "title_key": "goal.calm_face_wash.title",
      "icon": "water_drop",
      "area_key": "calm",
      "tabs": [
        "calm",
        "easy_wins"
      ],
      "difficulty": 1,
      "minutes": 2,
      "default_time_of_day": "any",
      "default_repeat": "daily",
      "need_tags": [
        "low_calm",
        "mid_calm"
      ]
    },
    {
      "key": "move_walk_alley",
      "title_key": "goal.move_walk_alley.title",
      "icon": "directions_walk",
      "area_key": "movement",
      "tabs": [
        "movement",
        "health",
        "easy_wins"
      ],
      "difficulty": 1,
      "minutes": 10,
      "default_time_of_day": "afternoon",
      "default_repeat": "daily",
      "need_tags": [
        "low_movement",
        "mid_movement"
      ]
    },
    {
      "key": "move_stairs",
      "title_key": "goal.move_stairs.title",
      "icon": "stairs",
      "area_key": "movement",
      "tabs": [
        "movement",
        "health"
      ],
      "difficulty": 2,
      "minutes": 3,
      "default_time_of_day": "any",
      "default_repeat": "daily",
      "need_tags": [
        "mid_movement"
      ]
    },
    {
      "key": "move_stretch_morning",
      "title_key": "goal.move_stretch_morning.title",
      "icon": "self_improvement",
      "area_key": "movement",
      "tabs": [